"Twinings 트와이닝 잉글리시 블랙퍼스트 블랙 티 디카페인 100티백", "20,470", 25
"JanSport 하프 파인트 미니 백팩 블랙", "28,690", 23
"도브 부드러운 피부를 위한 모이스처라이징 뷰티 바, 무향, 저자극성 뷰티바, 민감한 피부, 피부에 영양을 공급하면서 효과적으로 박테리아를 씻어냄, 106.3g(3.75온스), 비누 14개, 무향, 1.5kg(52.5온스)", "23,170", 10
"JanSport 하프 핀트 백팩 파스텔 라일락", "32,030", 23
"Jarrow Formulas Jarro-Dophilus EPS 프로바이오틱스 100억 CFU, 임상 연구 균주 8개, 장 지원을 위한 식이 보충제, 식물성 캡슐 60개, 30일 분량", "19,760", 34
"Ralph Lauren 로잘린드 샌들 블랙 누벅 푸 7 B (M)", "34,210", 58
"Bioderma 아토덤 인텐시브 모이스처라이징 밤", "30,370", 2
"Force Factor 프로바이오슬림 사과 식초 젤리 120젤리", "18,730", 37
